{
  "analysis": {
    "run_date": "2026-02-18T00:00:00Z",
    "logic_name": "rm",
    "display_label": "rm",
    "description": "rm analysis",
    "program": "test",
    "program_version": "0.0"
  },
  "source": {
    "source_provider": "prov",
    "is_primary": true
  },
  "repeat_consensus": [
    {
      "repeat_consensus_key": "58bc82baa00a592e0b49f526b80a7c89",
      "repeat_name": "Alu",
      "repeat_class": "SINE",
      "repeat_type": "Alu",
      "repeat_consensus": "ACGT"
    }
  ],
  "repeat_features": [
    {
      "seq_region": "comp1",
      "seq_region_start": 10,
      "seq_region_end": 20,
      "seq_region_strand": 1,
      "repeat_start": 1,
      "repeat_end": 10,
      "repeat_consensus": "58bc82baa00a592e0b49f526b80a7c89"
    }
  ]
}
